review_id,username,review_text,rating,review_date,helpful_count,app_name,platform,country,scraped_at,has_explicit_content,has_age_concerns,has_mental_health,has_algorithm,has_parental_controls,is_relevant,review_text_clean,language,age_category,explicit_age,age_inference_method,word_count,vader_neg,vader_neu,vader_pos,vader_compound,sentiment_category,textblob_polarity,textblob_subjectivity,sentiment_combined
e7a7186f-48a4-42dd-a7e1-2d8658f4b1b1,A Google user,band my daughter for some reason and she wasn't even doing nothing,1,2026-01-05 09:36:52,1,tiktok,google_play,np,2026-01-16T19:24:16.544516,False,True,False,False,False,True,band my daughter for some reason and she wasn't even doing nothing,en,parent,,role_indicator,12,0.0,1.0,0.0,0.0,neutral,0.0,0.0,0.0
b35d1fb2-4445-4e33-a270-28a21e95a6e0,A Google user,"I was 13 and it banned me, the worst app I have likely is better then this app",2,2026-01-05 08:00:31,1,tiktok,google_play,np,2026-01-16T19:24:16.544516,False,True,False,False,False,True,i was 13 and it banned me the worst app i have likely is better then this app,en,unknown,,no_indicator,18,0.284,0.6,0.116,-0.6369,negative,-0.16666666666666666,0.8333333333333334,-0.4017833333333333
ca43c0d4-8322-4274-95f5-38647d07eb44,A Google user,"After the new Creator Rewards update, the monetization system has become unfair and confusing. Only views coming from Search with at least 30 seconds of watch time are counted, while most For You Page views are ignored. This change negatively impacts small and growing creators and makes earnings unpredictable. The RPM and qualified views data lack transparency. TikTok should reconsider this policy and support creators more fairly.",1,2026-01-05 07:37:24,0,tiktok,google_play,np,2026-01-16T19:24:16.544516,False,False,False,True,False,True,after the new creator rewards update the monetization system has become unfair and confusing only views coming from search with at least 30 seconds of watch time are counted while most for you page views are ignored this change negatively impacts small and growing creators and makes earnings unpredictable the rpm and qualified views data lack transparency tiktok should reconsider this policy and support creators more fairly,en,unknown,,no_indicator,67,0.125,0.778,0.097,-0.2732,negative,0.0017906336088154133,0.6322314049586777,-0.13570468319559228
66971195-4325-437f-b151-c18e743427cb,A Google user,Ads are out of control. Every 3 videos and i get a ad. Sharing feedback on it in the app just makes it happen more. Please dont turn into Adtube and turn into a place that farms and turns people into viewer slaves for ad revenue.,1,2026-01-05 07:35:28,0,tiktok,google_play,np,2026-01-16T19:24:16.544516,False,False,False,True,False,True,ads are out of control every 3 videos and i get a ad sharing feedback on it in the app just makes it happen more please dont turn into adtube and turn into a place that farms and turns people into viewer slaves for ad revenue,en,unknown,,no_indicator,46,0.0,0.891,0.109,0.659,positive,0.5,0.5,0.5795
c6691a7a-5d91-4be4-babb-0b5627ef661f,A Google user,it's giving me the kid one when I need the adult one,1,2026-01-05 06:59:22,0,tiktok,google_play,np,2026-01-16T19:24:16.544516,True,False,False,False,False,True,it's giving me the kid one when i need the adult one,en,unknown,,no_indicator,12,0.0,0.821,0.179,0.34,positive,0.1,0.3,0.22000000000000003
fc9d7a7b-6f9f-4495-aeca-19a6815669c9,A Google user,im addicted,5,2026-01-05 05:47:05,0,tiktok,google_play,np,2026-01-16T19:24:16.544516,False,False,True,False,False,True,im addicted,cy,unknown,,no_indicator,2,0.0,1.0,0.0,0.0,neutral,-0.4,0.6,-0.2
6d2a715b-627f-4678-a467-c22139335d22,A Google user,"I always get banned on lives for literally no reason, I jokingly call my friend a midget and I get banned yet people on that app, smoke weed, post half naked pics/videos and don't get banned at all, honestly tiktok sort yourself out",1,2026-01-05 04:51:34,1,tiktok,google_play,np,2026-01-16T19:24:16.544516,True,False,False,False,False,True,i always get banned on lives for literally no reason i jokingly call my friend a midget and i get banned yet people on that app smoke weed post half naked pics videos and don't get banned at all honestly tiktok sort yourself out,en,unknown,,no_indicator,44,0.149,0.692,0.158,0.123,positive,0.14444444444444446,0.48888888888888893,0.13372222222222224
53616138-2451-4293-a2ba-d60748f5479b,A Google user,"seeing friends that blocked me. hurt me so badly and deeply, I'm depressed now from on",1,2026-01-05 03:51:22,84,tiktok,google_play,np,2026-01-16T19:24:16.544516,False,False,True,False,True,True,seeing friends that blocked me hurt me so badly and deeply i'm depressed now from on,en,unknown,,no_indicator,16,0.469,0.414,0.117,-0.8545,negative,-0.3499999999999999,0.5333333333333333,-0.60225
83e5968d-c966-424d-ae97-42e03ff3ee6d,A Google user,It's ridiculous that a man in his mid 20s is being age restricted on this app and being called a liar by their AI age verification. It seems like this app is pushing me to enter me credit card information as the only way to verify myself which is highly suspicious.,1,2026-01-05 03:46:53,0,tiktok,google_play,np,2026-01-16T19:24:16.544516,False,False,False,False,True,True,it's ridiculous that a man in his mid 20s is being age restricted on this app and being called a liar by their ai age verification it seems like this app is pushing me to enter me credit card information as the only way to verify myself which is highly suspicious,en,unknown,,no_indicator,51,0.183,0.734,0.083,-0.7264,negative,-0.04333333333333333,0.635,-0.3848666666666667
6e7f3dd5-b3d6-4ebd-a454-ae41a1ac0234,A Google user,"The filters should be more natural, the quality of the videos should be higher, and there should be more capabilities for recording clips.",5,2026-01-05 03:33:09,0,tiktok,google_play,np,2026-01-16T19:24:16.544516,False,False,False,False,True,True,the filters should be more natural the quality of the videos should be higher and there should be more capabilities for recording clips,en,unknown,,no_indicator,23,0.0,0.887,0.113,0.4201,positive,0.3375,0.475,0.3788
34dae1ce-8c6a-4e5f-bf3f-774ac4d8ad40,A Google user,"ok so a few days ago, I got suspended from dm'ing people bc of how I was speaking to my bf. Tiktok is now wanting to say I'm under the age of 16 when I am in fact not and had my dms opened up ON MY BIRTHDAY. I can only appeal by showing a state issued ID which I don't have because I do not have my driver's license. not upset abt the suspension but I'm upset abt it telling me I'm under age when I'm not. it's very frustrating.",3,2026-01-05 02:16:08,0,tiktok,google_play,np,2026-01-16T19:24:16.544516,False,True,False,False,False,True,ok so a few days ago i got suspended from dm'ing people bc of how i was speaking to my bf tiktok is now wanting to say i'm under the age of 16 when i am in fact not and had my dms opened up on my birthday i can only appeal by showing a state issued id which i don't have because i do not have my driver's license not upset abt the suspension but i'm upset abt it telling me i'm under age when i'm not it's very frustrating,en,unknown,,no_indicator,91,0.056,0.877,0.068,0.0455,neutral,-0.05500000000000001,0.65,-0.004750000000000004
a899e40f-de88-467d-9f1b-61e5c0939a57,A Google user,but the download waste time,5,2026-01-05 01:58:41,0,tiktok,google_play,np,2026-01-16T19:24:16.544516,False,False,True,False,False,True,but the download waste time,en,unknown,,no_indicator,5,0.481,0.519,0.0,-0.5719,negative,-0.2,0.0,-0.38595
adff89fc-5755-48d2-bff6-109061bc7833,A Google user,"TikTok’s AI moderation is broken. Adult content often stays up, while normal, harmless videos get flagged and stuck in a slow, frustrating “human review” process. There’s no transparency and no urgency. For an app used by so many kids, this is unacceptable. The moderation clearly prioritizes automation over safety. Not safe for children.",1,2026-01-05 01:30:50,1,tiktok,google_play,np,2026-01-16T19:24:16.544516,True,True,False,False,False,True,tiktok s ai moderation is broken adult content often stays up while normal harmless videos get flagged and stuck in a slow frustrating human review process there s no transparency and no urgency for an app used by so many kids this is unacceptable the moderation clearly prioritizes automation over safety not safe for children,en,unknown,,no_indicator,55,0.253,0.64,0.107,-0.8521,negative,-0.055555555555555566,0.4592592592592592,-0.4538277777777778
413e7d14-393f-4e4e-a597-e2aa5219f406,A Google user,I have a complaint mainly concerning why mostly tiktok pauses and hangs it is really annoying and another thing is that whenever I say I'm not interested in some posts it continues coming on my fyp sooo I don't like that please fix this soon,1,2026-01-05 01:24:26,1,tiktok,google_play,np,2026-01-16T19:24:16.544516,False,False,False,True,False,True,i have a complaint mainly concerning why mostly tiktok pauses and hangs it is really annoying and another thing is that whenever i say i'm not interested in some posts it continues coming on my fyp sooo i don't like that please fix this soon,en,unknown,,no_indicator,45,0.224,0.776,0.0,-0.8599,negative,-0.11166666666666666,0.48666666666666664,-0.48578333333333334
22fef393-8c46-4010-9a78-0ac4a7b224ec,A Google user,"Allow me to filter out #fyp and #foryou, the lowest quality content contains those tags but they cannot be filtered out.",1,2026-01-05 01:14:29,4,tiktok,google_play,np,2026-01-16T19:24:16.544516,False,False,False,True,True,True,allow me to filter out fyp and foryou the lowest quality content contains those tags but they cannot be filtered out,en,unknown,,no_indicator,21,0.081,0.854,0.065,-0.09,negative,0.0,0.0,-0.045
9b3f22a1-cecb-4996-9737-332557aaeb02,A Google user,"Tiktok isn't a ""bad"" app. It is helpful, depending on what I search for, and its toleratable to the point where I can spend a few hours on it and not notice. My main reason to not give it 5 stars though, is because of the messaging. I have a few friends who don't have phone numbers, or snapchat, and our only form of communication is Tiktok Messaging. It's mainly good, but it is VERY annoying when you are typing, and it suggests ""gifs"" for you to use. It blocks messages,and makes it harder to see",3,2026-01-05 00:28:42,0,tiktok,google_play,np,2026-01-16T19:24:16.544516,False,False,True,False,True,True,tiktok isn't a bad app it is helpful depending on what i search for and its toleratable to the point where i can spend a few hours on it and not notice my main reason to not give it 5 stars though is because of the messaging i have a few friends who don't have phone numbers or snapchat and our only form of communication is tiktok messaging it's mainly good but it is very annoying when you are typing and it suggests gifs for you to use it blocks messages and makes it harder to see,en,unknown,,no_indicator,97,0.06,0.865,0.074,-0.1317,negative,-0.16666666666666669,0.47500000000000003,-0.14918333333333333
817ba4b1-490c-40d1-8ac0-f19b00323ce4,A Google user,because I don't have all the filters 😡😠,1,2026-01-04 23:48:50,0,tiktok,google_play,np,2026-01-16T19:24:16.544516,False,False,False,False,True,True,because i don't have all the filters,en,unknown,,no_indicator,7,0.0,1.0,0.0,0.0,neutral,0.0,0.0,0.0
5f6167bb-2a7a-4300-97a9-c7afc12400e5,A Google user,I would love to give this app a 5 star but they are banning people for no accurate reason like they banned my account yesterday because my age doesn't reach the qualifications they want I put 13 years and they told me to log in again or I should appeal if they want to raise my ban I tried to appeal but it didn't work my account was doing very great almost going to 50 and I struggled before I could get 39 followers I wanted to log out and in but they didn't allow so I had to delete tiktok,1,2026-01-04 23:43:07,1,tiktok,google_play,np,2026-01-16T19:24:16.544516,False,True,False,False,False,True,i would love to give this app a 5 star but they are banning people for no accurate reason like they banned my account yesterday because my age doesn't reach the qualifications they want i put 13 years and they told me to log in again or i should appeal if they want to raise my ban i tried to appeal but it didn't work my account was doing very great almost going to 50 and i struggled before i could get 39 followers i wanted to log out and in but they didn't allow so i had to delete tiktok,en,adult,,role_indicator,101,0.146,0.733,0.121,-0.4715,negative,0.4333333333333333,0.7361111111111112,-0.01908333333333334
0721f0fb-0c27-4f20-b015-671d69bbcb7e,A Google user,you BANNED me for being too young?!,1,2026-01-04 23:14:48,1,tiktok,google_play,np,2026-01-16T19:24:16.544516,False,True,False,False,False,True,you banned me for being too young,en,unknown,,no_indicator,7,0.333,0.667,0.0,-0.4588,negative,0.1,0.4,-0.1794
f108fd6f-9b02-4d2c-83fa-0ad1db3cb1b1,A Google user,"Live sales shopping carts do not load correctly. Missing buttons or blank areas. I checked on my old iPhone, and they showed perfectly. They need bug fixes for the Android platform.I have a screenshot of what I am talking about. If the developers want to reach out for that screenshot to see what I am seeing, it's only from the live sale shopping carts at checkout, not the direct page of a shop because those display appropriately. I'm using Android version 16.",3,2026-01-04 22:50:10,26,tiktok,google_play,np,2026-01-16T19:24:16.544516,False,True,False,False,False,True,live sales shopping carts do not load correctly missing buttons or blank areas i checked on my old iphone and they showed perfectly they need bug fixes for the android platform i have a screenshot of what i am talking about if the developers want to reach out for that screenshot to see what i am seeing it's only from the live sale shopping carts at checkout not the direct page of a shop because those display appropriately i'm using android version 16,en,unknown,,no_indicator,83,0.0,0.903,0.097,0.7571,positive,0.196969696969697,0.46111111111111114,0.4770348484848485
c97c4b4c-8d56-4eea-91db-88340a40fd7a,A Google user,you have to be a teen to be in Tiktok if your younger you'll get banned.,4,2026-01-04 21:06:15,0,tiktok,google_play,np,2026-01-16T19:24:16.544516,False,True,False,False,False,True,you have to be a teen to be in tiktok if your younger you'll get banned,en,teen,,role_indicator,16,0.167,0.833,0.0,-0.4588,negative,0.0,0.0,-0.2294
98096aea-c071-484a-8240-b080218f9ade,A Google user,you have a glitch in saved videos where it shows i have saved videos but they are not there-not even the classic grey removed/deleted option for example in one of my playlists it says 17 videos in a saved playlist but only 16 squares show up when i click edit to delete the removed content its across all my savecd content and its obnoxious.,1,2026-01-04 20:17:54,1,tiktok,google_play,np,2026-01-16T19:24:16.544516,False,True,False,False,False,True,you have a glitch in saved videos where it shows i have saved videos but they are not there not even the classic grey removed deleted option for example in one of my playlists it says 17 videos in a saved playlist but only 16 squares show up when i click edit to delete the removed content its across all my savecd content and its obnoxious,en,unknown,,no_indicator,66,0.054,0.827,0.119,0.4215,positive,0.03888888888888888,0.4222222222222222,0.23019444444444442
0df9f037-d097-42be-8f90-d661fc161ce1,A Google user,"app is a great way to waste time but god forbid something happens to your account, like getting hacked, the support team is absolutely useless and will ban your account AFTER you regain access and keep sending the same automated reply when you reach out",1,2026-01-04 20:14:14,3,tiktok,google_play,np,2026-01-16T19:24:16.544516,False,False,True,False,False,True,app is a great way to waste time but god forbid something happens to your account like getting hacked the support team is absolutely useless and will ban your account after you regain access and keep sending the same automated reply when you reach out,en,unknown,,no_indicator,45,0.266,0.534,0.2,-0.7422,negative,0.025000000000000022,0.26875,-0.3586
3701e127-bda2-44c4-a471-292f03ad82a8,A Google user,"It's a very good app, I have been using it for a long time and I recommend it, but parental control needs to be tightened or administrators need to look at the inappropriate contents, take control and remove them. Because it contains content that isn't suitable for minors, other than that, it's an excellent app.",3,2026-01-04 19:54:55,108,tiktok,google_play,np,2026-01-16T19:24:16.544516,True,True,False,False,True,True,it's a very good app i have been using it for a long time and i recommend it but parental control needs to be tightened or administrators need to look at the inappropriate contents take control and remove them because it contains content that isn't suitable for minors other than that it's an excellent app,en,unknown,,no_indicator,55,0.0,0.854,0.146,0.8358,positive,0.457,0.661,0.6464
4b080986-9599-478d-8e30-6258f38f1e77,A Google user,Good App For Time Pass Youth.,2,2026-01-04 19:47:27,4,tiktok,google_play,np,2026-01-16T19:24:16.544516,False,True,False,False,False,True,good app for time pass youth,en,unknown,,no_indicator,6,0.0,0.633,0.367,0.4404,positive,0.7,0.6000000000000001,0.5702
483884e8-1fd8-457c-a094-0dd8a6fafe53,A Google user,account not recommended remove status please TikTok profile problem 😔 update complete 💯✅ please problem solve 😭😭,1,2026-01-04 19:27:40,1,tiktok,google_play,np,2026-01-16T19:24:16.544516,False,False,False,True,False,True,account not recommended remove status please tiktok profile problem update complete please problem solve,en,unknown,,no_indicator,14,0.327,0.374,0.299,-0.1511,negative,0.1,0.4,-0.025550000000000003
eda12eb8-a613-442b-bb56-adfb4e2bc971,A Google user,it would let me scroll but then it would tell me that I am too young and ask me to appeal and when I do it doesn't work and it won't let me sign in I used to love it but now it's annoying,3,2026-01-04 19:00:24,5,tiktok,google_play,np,2026-01-16T19:24:16.544516,False,True,False,False,False,True,it would let me scroll but then it would tell me that i am too young and ask me to appeal and when i do it doesn't work and it won't let me sign in i used to love it but now it's annoying,en,adult,,role_indicator,44,0.069,0.818,0.113,0.5023,positive,-0.0666666666666667,0.6333333333333333,0.21781666666666663
a74a34cc-466f-4a07-8078-ad022592ef32,A Google user,"TikTok’s age verification is completely broken. I’m 21, yet my account was age-restricted. I’ve submitted my date of birth and photo nearly 20 times with zero results. No explanation, no fix, no real response. This is frustrating and unacceptable for a platform this big.",1,2026-01-04 18:29:17,1,tiktok,google_play,np,2026-01-16T19:24:16.544516,False,False,False,False,True,True,tiktok s age verification is completely broken i m 21 yet my account was age restricted i ve submitted my date of birth and photo nearly 20 times with zero results no explanation no fix no real response this is frustrating and unacceptable for a platform this big,en,unknown,,no_indicator,48,0.239,0.696,0.064,-0.8838,negative,-0.16,0.42000000000000004,-0.5219
1beaec14-29f8-46c5-87d3-4dd636c0a079,A Google user,Hey TikTok I believe my account for flagged for messaging by mistake I follow I always followed the rule and would appreciate for message restrictions thank you please remove message resistration for my account my account user name is (itsmeladla1) please thank you,1,2026-01-04 18:07:51,1,tiktok,google_play,np,2026-01-16T19:24:16.544516,False,False,False,False,True,True,hey tiktok i believe my account for flagged for messaging by mistake i follow i always followed the rule and would appreciate for message restrictions thank you please remove message resistration for my account my account user name is itsmeladla1 please thank you,en,unknown,,no_indicator,43,0.046,0.716,0.238,0.836,positive,0.0,0.0,0.418
9141f376-4c93-4cf1-9a98-730159442b81,A Google user,Gives you strikes and warnings for no reason. Also they allow sexual content every December and don't do nothing about it but I type nuke the whole generation as the joke I get strikes on my account,1,2026-01-04 18:07:12,1,tiktok,google_play,np,2026-01-16T19:24:16.544516,True,False,False,False,False,True,gives you strikes and warnings for no reason also they allow sexual content every december and don't do nothing about it but i type nuke the whole generation as the joke i get strikes on my account,en,unknown,,no_indicator,37,0.189,0.713,0.098,-0.4497,negative,0.35,0.6166666666666667,-0.049850000000000005
15a95813-e6e4-4b52-bb6b-8b3c83825d31,A Google user,"Hello TikTok Support Team, My TikTok account is not getting any views for the past few days. It seems like my account has been frozen or restricted, even though I have not violated any TikTok policies. Please review my account and remove any restrictions if applied, and restore my account to normal status. Thank you for your support. Username: (lala.baloch9)",5,2026-01-04 18:06:54,1,tiktok,google_play,np,2026-01-16T19:24:16.544516,False,False,False,False,True,True,hello tiktok support team my tiktok account is not getting any views for the past few days it seems like my account has been frozen or restricted even though i have not violated any tiktok policies please review my account and remove any restrictions if applied and restore my account to normal status thank you for your support username lala baloch9,en,unknown,,no_indicator,61,0.035,0.723,0.241,0.9198,positive,-0.10000000000000002,0.3333333333333333,0.4099
5e7cc62e-69ee-432a-ad8e-e845826b44ce,A Google user,TikTok video of the school and keeps me up a bit ago and keeps me up a,1,2026-01-04 18:03:04,1,tiktok,google_play,np,2026-01-16T19:24:16.544516,False,True,False,False,False,True,tiktok video of the school and keeps me up a bit ago and keeps me up a,en,unknown,,no_indicator,17,0.0,1.0,0.0,0.0,neutral,0.0,0.0,0.0
32b0bdbe-a16e-4c67-8ddc-7e815f91fc90,A Google user,"Good app, if you're in a good community. Usually, this app has a lot of things that can make your child ""brainrot"" or make them unusually sexual. Examples are, ""SKIBIDI SIGMA GYAT RIZZLER."" Those kinds of things ""gyat"" and ""rizz"" expose children to inappropriate things and increase interest in adultery at the wrong age.",3,2026-01-04 17:53:02,5,tiktok,google_play,np,2026-01-16T19:24:16.544516,True,True,False,False,False,True,good app if you're in a good community usually this app has a lot of things that can make your child brainrot or make them unusually sexual examples are skibidi sigma gyat rizzler those kinds of things gyat and rizz expose children to inappropriate things and increase interest in adultery at the wrong age,en,unknown,,no_indicator,54,0.074,0.752,0.174,0.7506,positive,0.22999999999999998,0.6366666666666667,0.4903
97b89aa4-4a26-4f21-966d-dcbb6edec91b,A Google user,"Helpful suggestions to improve the app: Allow people to pin people in DMS(at least three). Allow people the option to turn off notifications of people that reposted the same Tik Toks. Do better at removing bots. Allowing people to pay for better marketing instead of engagment, such as Ads. Make sure AI bot you can chat with to ask informative questions don't get lost in DMS so people can chat with it easily. Allow people to organize what people see in their algorithm/fyp.",5,2026-01-04 17:43:00,4,tiktok,google_play,np,2026-01-16T19:24:16.544516,False,False,False,True,False,True,helpful suggestions to improve the app allow people to pin people in dms at least three allow people the option to turn off notifications of people that reposted the same tik toks do better at removing bots allowing people to pay for better marketing instead of engagment such as ads make sure ai bot you can chat with to ask informative questions don't get lost in dms so people can chat with it easily allow people to organize what people see in their algorithm fyp,en,unknown,,no_indicator,85,0.014,0.746,0.24,0.961,positive,0.23333333333333334,0.5353174603174603,0.5971666666666666
7b58559a-acf2-4cca-9adc-fec2ad2b1841,A Google user,"[1/3, 1:13 AM] shankarmu361: My TikTok account has been banned, and I believe this may have been a mistake. I always strive to follow the community guidelines and respect the platform's rules. I kindly request you to review my account and provide clarification on the reason for the ban. [1/3, 1:15 AM] shankarmu361: Please consider restoring my account. Thank you for your time and support",5,2026-01-04 17:18:25,0,tiktok,google_play,np,2026-01-16T19:24:16.544516,False,True,False,False,False,True,1 3 1 13 am shankarmu361 my tiktok account has been banned and i believe this may have been a mistake i always strive to follow the community guidelines and respect the platform's rules i kindly request you to review my account and provide clarification on the reason for the ban 1 3 1 15 am shankarmu361 please consider restoring my account thank you for your time and support,en,unknown,,no_indicator,69,0.106,0.706,0.188,0.7184,positive,0.6,0.9,0.6592
bdba817e-7b9f-4f09-9b01-d3bacc52d9be,A Google user,"TikTok is more than just fun videos. I’ve learned skills, discovered talents, and enjoyed endless creativity. The app is smooth, entertaining, and inspiring. Highly recommended!",5,2026-01-04 17:12:25,0,tiktok,google_play,np,2026-01-16T19:24:16.544516,False,False,False,True,False,True,tiktok is more than just fun videos i ve learned skills discovered talents and enjoyed endless creativity the app is smooth entertaining and inspiring highly recommended,en,unknown,,no_indicator,26,0.0,0.484,0.516,0.9599,positive,0.34187500000000004,0.61125,0.6508875000000001
