review_id,username,review_text,rating,review_date,helpful_count,app_name,platform,country,scraped_at,has_explicit_content,has_age_concerns,has_mental_health,has_algorithm,has_parental_controls,is_relevant,review_text_clean,language,age_category,explicit_age,age_inference_method,word_count,vader_neg,vader_neu,vader_pos,vader_compound,sentiment_category,textblob_polarity,textblob_subjectivity,sentiment_combined
b01a4d8e-8abe-47a0-a5c8-c7e6ef0c3e26,A Google user,"One of the premium features, queue, has been broken for ages (forgets videos, doesn't respect order changes, etc.). The whole app aggressively pushes ""recommended"" content at every possible place to keep you hooked. Other than that it sort of works.",2,2026-01-11 17:23:09,7,youtube,google_play,np,2026-01-16T19:25:40.229987,False,False,False,True,False,True,one of the premium features queue has been broken for ages forgets videos doesn't respect order changes etc the whole app aggressively pushes recommended content at every possible place to keep you hooked other than that it sort of works,en,adult,,role_indicator,40,0.174,0.787,0.039,-0.7314,negative,-0.08125,0.54375,-0.40632500000000005
71ce39ae-f2fb-426d-96f9-7e1c4663f22b,A Google user,You blocked my account without any reason. Youtube is getting worst day by day.,1,2026-01-11 17:10:50,0,youtube,google_play,np,2026-01-16T19:25:40.229987,False,False,False,False,True,True,you blocked my account without any reason youtube is getting worst day by day,en,unknown,,no_indicator,14,0.341,0.659,0.0,-0.7351,negative,-1.0,1.0,-0.86755
bb771140-cca7-4291-a1a8-e01f3b6b5c09,A Google user,"Two stars and three reasons. Reason one: there is a lot of ads plus they are just UNSKIPPABLE and I'm just tired of these ads. Reason two: why do I always get emoji cat videos on my fyp, my fyp has to be healed! Reason three: When I go to app, I am on short WHEN I DON'T WANT TO! it's annoying. That's all, have a nice day.",2,2026-01-11 17:10:19,5,youtube,google_play,np,2026-01-16T19:25:40.229987,False,False,False,True,False,True,two stars and three reasons reason one there is a lot of ads plus they are just unskippable and i'm just tired of these ads reason two why do i always get emoji cat videos on my fyp my fyp has to be healed reason three when i go to app i am on short when i don't want to it's annoying that's all have a nice day,en,unknown,,no_indicator,68,0.093,0.869,0.038,-0.4628,negative,-0.15000000000000005,0.725,-0.3064
57584cc0-3a8d-42ee-a864-a3981a3d21de,A Google user,"SO PERFECT AND I can post video's, watch my favorite video's, and bunch of bad gooners 🙁 so recommended YouTube can you please stop these gooners🙁",5,2026-01-11 16:58:50,0,youtube,google_play,np,2026-01-16T19:25:40.229987,False,False,False,True,False,True,so perfect and i can post video's watch my favorite video's and bunch of bad gooners so recommended youtube can you please stop these gooners,en,unknown,,no_indicator,25,0.158,0.527,0.316,0.6894,positive,0.2666666666666667,0.8888888888888888,0.47803333333333337
cc623d4c-22ad-4c01-a1b8-e1e6da01aff9,A Google user,"Ads are everywhere, either landscape or potrait, watching experience is awful and frequently interrupted! Really awful, I hate it when ads pops out landscape or portrait! And btw, Sometimes I can't pick many playlist simultaneously to place my liked video! Would you let someone suffer from watching unskippable ads just for money? don't wanna waste time on ridiculous advertisement that obviously every users know ....I hate the update dbeerhnklxym ...",1,2026-01-11 16:40:31,1,youtube,google_play,np,2026-01-16T19:25:40.229987,False,False,True,False,False,True,ads are everywhere either landscape or potrait watching experience is awful and frequently interrupted really awful i hate it when ads pops out landscape or portrait and btw sometimes i can't pick many playlist simultaneously to place my liked video would you let someone suffer from watching unskippable ads just for money don't wanna waste time on ridiculous advertisement that obviously every users know i hate the update dbeerhnklxym,en,unknown,,no_indicator,69,0.254,0.687,0.059,-0.9518,negative,-0.29333333333333333,0.6900000000000001,-0.6225666666666667
2daefb35-17cd-48ba-8031-a8741ffb9ef3,A Google user,great for kids,5,2026-01-11 16:15:33,1,youtube,google_play,np,2026-01-16T19:25:40.229987,False,True,False,False,False,True,great for kids,da,unknown,,no_indicator,3,0.0,0.328,0.672,0.6249,positive,0.8,0.75,0.71245
bed13ce9-9480-4b27-b85c-f98fa98d4b8b,A Google user,so much add . in 1 hour vedio you will get 16 ads,1,2026-01-11 16:11:25,0,youtube,google_play,np,2026-01-16T19:25:40.229987,False,True,False,False,False,True,so much add in 1 hour vedio you will get 16 ads,en,unknown,,no_indicator,12,0.0,1.0,0.0,0.0,neutral,0.2,0.2,0.1
779a3a9b-b648-4220-a4b4-005c5d1ee1ca,A Google user,"way too much censorship, and the shorts algorithm is trash.",3,2026-01-11 16:10:11,0,youtube,google_play,np,2026-01-16T19:25:40.229987,False,False,False,True,False,True,way too much censorship and the shorts algorithm is trash,en,unknown,,no_indicator,10,0.0,1.0,0.0,0.0,neutral,0.2,0.2,0.1
cadd2bd2-0ff9-40bf-81be-6f035ebe794d,A Google user,MAN THIS APP IS NOT GOOD THIS APP IS TRYING TO MAKE ITS SELF MY DAD. WHAN I CHANAGE MY NAME IT SAYS YOU NEED TO WAIT 15 DAYS TO CHANGE YOUR NAME,1,2026-01-11 15:43:25,0,youtube,google_play,np,2026-01-16T19:25:40.229987,False,True,False,False,False,True,man this app is not good this app is trying to make its self my dad whan i chanage my name it says you need to wait 15 days to change your name,en,unknown,,no_indicator,33,0.07,0.93,0.0,-0.3412,negative,-0.35,0.6000000000000001,-0.3456
6c9eb849-2374-4f20-88d5-f29b13aee762,A Google user,Youtube decided for some reason tp change the search filters and get rid of upload date so now I can't find the most recent videos when i search. This week or this day doesn't work as it typicall starts to show up with videos not related to the topic at all,1,2026-01-11 15:04:48,0,youtube,google_play,np,2026-01-16T19:25:40.229987,False,False,False,False,True,True,youtube decided for some reason tp change the search filters and get rid of upload date so now i can't find the most recent videos when i search this week or this day doesn't work as it typicall starts to show up with videos not related to the topic at all,en,adult,,role_indicator,51,0.0,1.0,0.0,0.0,neutral,0.16666666666666666,0.3833333333333333,0.08333333333333333
52258bca-a579-48da-9085-9178f2b152e3,A Google user,"Ive loyally stuck with youtube for at least 15 to 20 years now off and on, more on the last 5 years. When radio djs have a hard time playing the good stuff because of new corporate pressure and advertising, youtube always had my back. Music is the only thing that helps me with my PTSD triggers. But, the last year or 2, totally let me down and continue to do so more and more each day. I cant watch a full music video longer than 3 or 4min without 30 sec to a min of commercials breaking every song.",1,2026-01-11 14:23:59,1,youtube,google_play,np,2026-01-16T19:25:40.229987,False,True,False,False,False,True,ive loyally stuck with youtube for at least 15 to 20 years now off and on more on the last 5 years when radio djs have a hard time playing the good stuff because of new corporate pressure and advertising youtube always had my back music is the only thing that helps me with my ptsd triggers but the last year or 2 totally let me down and continue to do so more and more each day i cant watch a full music video longer than 3 or 4min without 30 sec to a min of commercials breaking every song,en,unknown,,no_indicator,100,0.041,0.89,0.069,0.4404,positive,0.12779263220439693,0.45010398098633386,0.2840963161021985
c5e0882f-bac8-4efc-93dd-4c0a503a260b,A Google user,It helps a lot for my research for school and download movies fast and the ad are not too much,4,2026-01-11 13:44:33,0,youtube,google_play,np,2026-01-16T19:25:40.229987,False,True,False,False,False,True,it helps a lot for my research for school and download movies fast and the ad are not too much,en,unknown,,no_indicator,20,0.0,0.88,0.12,0.3818,positive,0.2,0.4,0.2909
f190df4f-1d2f-4673-a42d-37ba6f300727,A Google user,Giving this 1 star because the new 'Second Chance' pilot program is unfairly restrictive. Copyright-terminated channels deserve a path to redemption through education just like any other policy violation. Broaden the program to include copyright education so creators can fix their mistakes and return to the platform.,1,2026-01-11 13:39:46,0,youtube,google_play,np,2026-01-16T19:25:40.229987,False,False,False,False,True,True,giving this 1 star because the new 'second chance' pilot program is unfairly restrictive copyright terminated channels deserve a path to redemption through education just like any other policy violation broaden the program to include copyright education so creators can fix their mistakes and return to the platform,en,unknown,,no_indicator,48,0.103,0.773,0.124,0.0516,positive,-0.12215909090909091,0.45738636363636365,-0.03527954545454545
0319a034-0602-488d-94a9-a0543224d4c7,A Google user,YouTube is good for students 👀,3,2026-01-11 13:34:28,0,youtube,google_play,np,2026-01-16T19:25:40.229987,False,True,False,False,False,True,youtube is good for students,en,young_adult,,role_indicator,5,0.0,0.58,0.42,0.4404,positive,0.7,0.6000000000000001,0.5702
4fd077f5-5f9c-4dc9-b5d4-e253b36d9126,A Google user,where is no type of blog in this YouTube I want to watch block shorts and other type of blog,5,2026-01-11 13:26:37,0,youtube,google_play,np,2026-01-16T19:25:40.229987,False,False,False,False,True,True,where is no type of blog in this youtube i want to watch block shorts and other type of blog,en,unknown,,no_indicator,20,0.218,0.726,0.056,-0.5859,negative,-0.125,0.375,-0.35545
a1a798b1-74a5-4004-8f55-149fb4eefbde,A Google user,"What the hell is wrong with you??? I've been put in restricted mode for the past 2 days and the stupid app won't let me access comments, see my notifications or reply to people. Is that what Im paying Premium for??? Fix this ASAP!",1,2026-01-11 12:14:45,0,youtube,google_play,np,2026-01-16T19:25:40.229987,False,False,False,False,True,True,what the hell is wrong with you i've been put in restricted mode for the past 2 days and the stupid app won't let me access comments see my notifications or reply to people is that what im paying premium for fix this asap,en,unknown,,no_indicator,44,0.255,0.745,0.0,-0.9287,negative,-0.5166666666666666,0.7166666666666667,-0.7226833333333333
b618f496-c4f4-44e5-a014-fb4737abe7c3,A Google user,"Getting sick of nonsense. Closed captioning turns itself BACK ON with every ad break on every device I try. Device settings CC are off. I KEEP turning them off on Youtube, but that's ot good enough. I stopped using Youtube for a long time because they kept force feeding me the same ads I requested NOT to see, so now I just feel like they're screwing with me.",1,2026-01-11 12:07:25,3,youtube,google_play,np,2026-01-16T19:25:40.229987,False,False,False,True,False,True,getting sick of nonsense closed captioning turns itself back on with every ad break on every device i try device settings cc are off i keep turning them off on youtube but that's ot good enough i stopped using youtube for a long time because they kept force feeding me the same ads i requested not to see so now i just feel like they're screwing with me,en,unknown,,no_indicator,68,0.112,0.797,0.091,0.1027,positive,-0.023469387755102045,0.36887755102040815,0.03961530612244898
cc58fe5e-18e1-46db-926f-26e1f8a8298a,A Google user,Please am using Samsung galaxy A3 2016 but you wrote me that my device is not compatible with the this app.So should I contact you.,1,2026-01-11 11:58:26,0,youtube,google_play,np,2026-01-16T19:25:40.229987,False,True,False,False,False,True,please am using samsung galaxy a3 2016 but you wrote me that my device is not compatible with the this app so should i contact you,en,unknown,,no_indicator,26,0.0,0.938,0.062,0.1655,positive,0.0,0.0,0.08275
01cac275-f150-42d4-a98b-fb86275df8aa,A Google user,"Unable to access a Google product, even after giving all the permissions, this is what popping when I try to open YouTube app .I was able to do in samsung phone before, but in oneplus 15R, but the app says it is compatible with oneplus 15R , but it kept showing even though I have not handling a youtube channel",1,2026-01-11 11:45:03,1,youtube,google_play,np,2026-01-16T19:25:40.229987,False,True,False,False,False,True,unable to access a google product even after giving all the permissions this is what popping when i try to open youtube app i was able to do in samsung phone before but in oneplus 15r but the app says it is compatible with oneplus 15r but it kept showing even though i have not handling a youtube channel,en,unknown,,no_indicator,59,0.0,0.972,0.028,0.1779,positive,0.0,0.5416666666666666,0.08895
faaddf3d-13b3-4c4b-ac15-c76b0aaee4e3,A Google user,144p quality video 🤦🏼‍♂️,2,2026-01-11 11:33:28,1,youtube,google_play,np,2026-01-16T19:25:40.229987,False,True,False,False,False,True,144p quality video,it,unknown,,no_indicator,3,0.0,1.0,0.0,0.0,neutral,0.0,0.0,0.0
aadf060e-71d0-4f88-a30f-29758ff8c030,A Google user,make it overly difficult to report sexually provocative or obvious ai based scams. money pays well i guess. eagerly waiting for an alternative,1,2026-01-11 11:16:38,1,youtube,google_play,np,2026-01-16T19:25:40.229987,True,False,False,False,False,True,make it overly difficult to report sexually provocative or obvious ai based scams money pays well i guess eagerly waiting for an alternative,en,unknown,,no_indicator,23,0.21,0.633,0.157,-0.3818,negative,0.0,0.7777777777777778,-0.1909
8aa5d736-e67f-4fdf-b81f-9837f85b35a5,A Google user,this app is abusing its customers by its fruad advertisments ! Scaners and fraudulent people from all over the world download fake AI made videos to lure innocent people to fake products or even to scam them or finally hack their bank accounts! other than that also the short videos set up sucks! there are so much things in the screen that you even can't see the clip itself! to make it worse they recently aded top comment buble in the short videos to block more area !!,1,2026-01-11 10:51:16,0,youtube,google_play,np,2026-01-16T19:25:40.229987,False,False,False,False,True,True,this app is abusing its customers by its fruad advertisments scaners and fraudulent people from all over the world download fake ai made videos to lure innocent people to fake products or even to scam them or finally hack their bank accounts other than that also the short videos set up sucks there are so much things in the screen that you even can't see the clip itself to make it worse they recently aded top comment buble in the short videos to block more area,en,unknown,,no_indicator,86,0.235,0.725,0.04,-0.9657,negative,-0.009615384615384616,0.5403846153846154,-0.4876576923076923
4680963e-1378-4edb-8ce7-a2ffc20ad08f,A Google user,"I didn't like the new feature hype, it needs more filters and options.",1,2026-01-11 09:43:15,0,youtube,google_play,np,2026-01-16T19:25:40.229987,False,False,False,False,True,True,i didn't like the new feature hype it needs more filters and options,en,unknown,,no_indicator,13,0.15,0.85,0.0,-0.2755,negative,0.3181818181818182,0.4772727272727273,0.021340909090909077
bbfadd82-4312-4544-a47e-ebcc3a0dc9e1,A Google user,"I can entertain myself and my child's. I can learn something and my child's, to😄",5,2026-01-11 08:14:37,0,youtube,google_play,np,2026-01-16T19:25:40.229987,False,True,False,False,False,True,i can entertain myself and my child's i can learn something and my child's to,en,unknown,,no_indicator,15,0.0,0.859,0.141,0.3182,positive,0.0,0.0,0.1591
7f35a230-f8e3-4937-b4bb-8207b5b73021,A Google user,Because i apeald it doesn't want me to watch videos and i am 7 years old,1,2026-01-11 07:45:29,0,youtube,google_play,np,2026-01-16T19:25:40.229987,False,True,False,False,False,True,because i apeald it doesn't want me to watch videos and i am 7 years old,en,unknown,,no_indicator,16,0.075,0.925,0.0,-0.0572,negative,0.1,0.2,0.021400000000000002
911f562b-08e7-4a75-b3bc-5a61d80bb0b2,A Google user,"this is too censored and stale for my take, AI videos and kids content have ruined this app I once loved. the guidelines are too strict for my liking",1,2026-01-11 07:05:13,0,youtube,google_play,np,2026-01-16T19:25:40.229987,False,True,False,False,False,True,this is too censored and stale for my take ai videos and kids content have ruined this app i once loved the guidelines are too strict for my liking,en,unknown,,no_indicator,29,0.129,0.689,0.182,0.4404,positive,0.09999999999999998,0.65,0.2702
b24fcfb3-dcef-4b2b-874a-3a0ac0f541d9,A Google user,"Too many ads. Even for 15 sec video,ad is displayed.please have a control over these ads options. Limit the ads and their frequency, duration of ads. Not even fit for single star. Sucks up the data. Better End your service in internet.",1,2026-01-11 06:54:36,4,youtube,google_play,np,2026-01-16T19:25:40.229987,False,True,False,False,False,True,too many ads even for 15 sec video ad is displayed please have a control over these ads options limit the ads and their frequency duration of ads not even fit for single star sucks up the data better end your service in internet,en,unknown,,no_indicator,44,0.093,0.803,0.104,0.1506,positive,0.15476190476190477,0.41904761904761906,0.1526809523809524
6a5b04c4-def6-45a5-964b-e21b816d6933,A Google user,YouTube search filters is now stupid because of the new update. why the HECK DID YOU REMOVE UPLOAD DATE. the update made things worst and harder to look for new video. I would give negative stars if I give. I hate this update,1,2026-01-11 06:38:01,1,youtube,google_play,np,2026-01-16T19:25:40.229987,False,False,False,False,True,True,youtube search filters is now stupid because of the new update why the heck did you remove upload date the update made things worst and harder to look for new video i would give negative stars if i give i hate this update,en,unknown,,no_indicator,43,0.276,0.724,0.0,-0.9423,negative,-0.38961038961038963,0.6012987012987013,-0.6659551948051948
66e66108-9ad1-4271-9de3-23c9fe13b40a,A Google user,"Every time they update this app, it gets worse. I'm not installing updates anymore. Just came back a year and a half later to say this is still true. It auto installed an update and now I'm pissed. GET RID OF SHORTS! I never want to see them, I always click the X, yet they keep showing up in my feed. What gives? Why can't I disable them entirely? Seems pretty stupid!",1,2026-01-11 06:24:55,2,youtube,google_play,np,2026-01-16T19:25:40.229987,False,False,False,True,False,True,every time they update this app it gets worse i'm not installing updates anymore just came back a year and a half later to say this is still true it auto installed an update and now i'm pissed get rid of shorts i never want to see them i always click the x yet they keep showing up in my feed what gives why can't i disable them entirely seems pretty stupid,en,unknown,,no_indicator,72,0.144,0.781,0.074,-0.7102,negative,-0.09583333333333333,0.5052083333333333,-0.4030166666666667
2a9ba53a-d071-4ae9-95a3-e408d78a7156,A Google user,WAY too many ads. Now I'm getting qr codes popping up in videos blocking a large portion of the screen. I've been using YouTube less and less because ads have gotten out of control and this might be enough to make me stop using entirely. I'm sick of this,1,2026-01-11 06:01:21,2,youtube,google_play,np,2026-01-16T19:25:40.229987,False,False,False,False,True,True,way too many ads now i'm getting qr codes popping up in videos blocking a large portion of the screen i've been using youtube less and less because ads have gotten out of control and this might be enough to make me stop using entirely i'm sick of this,en,unknown,,no_indicator,49,0.154,0.846,0.0,-0.8115,negative,-0.055555555555555546,0.40317460317460313,-0.4335277777777778
d6265790-4471-4ea8-bb9f-a835976bc996,A Google user,I can't see the dislike button anymore this app is garbage it freezes and they force a garbage algorithm which doesn't allow me to see my subscribed content you have to manually go to all subs just pirate it.,1,2026-01-11 04:36:52,1,youtube,google_play,np,2026-01-16T19:25:40.229987,False,False,False,True,False,True,i can't see the dislike button anymore this app is garbage it freezes and they force a garbage algorithm which doesn't allow me to see my subscribed content you have to manually go to all subs just pirate it,en,unknown,,no_indicator,39,0.068,0.879,0.053,0.1073,positive,0.0,0.0,0.05365
d22d908e-e407-4d31-bffb-f5f62d357e4b,A Google user,this app is kinda sucks because when I upload a video it will always be copyrighted even if I mute the vid it still has copyright and I add a filter on my vid and guest what is still has copyright and now I can't open my YouTube I don't know why but some reason I can't open it it just has a black screen,2,2026-01-11 04:24:27,1,youtube,google_play,np,2026-01-16T19:25:40.229987,False,False,False,False,True,True,this app is kinda sucks because when i upload a video it will always be copyrighted even if i mute the vid it still has copyright and i add a filter on my vid and guest what is still has copyright and now i can't open my youtube i don't know why but some reason i can't open it it just has a black screen,en,unknown,,no_indicator,65,0.024,0.976,0.0,-0.154,negative,-0.11666666666666667,0.43333333333333335,-0.13533333333333333
1fe7bed0-573b-4931-a6e4-156619b58621,A Google user,"I used to love this app, used it for educational purposes, news and hobbies such as sports. Then came the forced change from subscription based feed to generated feed, then bombardment of shorts, the ads left right and center and the infinite stream of lower quality content. Thanks for nothing, and certainly not for the addiction I've developed to this app.",1,2026-01-11 03:27:48,5,youtube,google_play,np,2026-01-16T19:25:40.229987,False,False,True,True,False,True,i used to love this app used it for educational purposes news and hobbies such as sports then came the forced change from subscription based feed to generated feed then bombardment of shorts the ads left right and center and the infinite stream of lower quality content thanks for nothing and certainly not for the addiction i've developed to this app,en,unknown,,no_indicator,61,0.103,0.796,0.101,0.2177,positive,0.08285714285714285,0.32571428571428573,0.15027857142857143
fda3aa29-d0b7-4b2a-93ab-badfd3feaeb4,A Google user,this app is just bad. get a third party player. and why do you have the option to change playback speed on the TV app if you'll just automatically drop me to 144p to play 125% speed? not a bandwidth issue either,1,2026-01-11 02:58:27,2,youtube,google_play,np,2026-01-16T19:25:40.229987,False,True,False,False,False,True,this app is just bad get a third party player and why do you have the option to change playback speed on the tv app if you'll just automatically drop me to 144p to play 125 speed not a bandwidth issue either,en,unknown,,no_indicator,42,0.115,0.78,0.105,-0.128,negative,-0.3499999999999999,0.3333333333333333,-0.23899999999999996
17130204-b7f2-4911-b842-b07e738bfa59,A Google user,"they put age restrictions on to act like it's for kids, no they want your personal information to know everything you watch and look up. they don't need that information they just want to sell it to Google for money. I'd give it 0 stars if I could.",1,2026-01-11 02:31:02,1,youtube,google_play,np,2026-01-16T19:25:40.229987,False,True,False,False,True,True,they put age restrictions on to act like it's for kids no they want your personal information to know everything you watch and look up they don't need that information they just want to sell it to google for money i'd give it 0 stars if i could,en,unknown,,no_indicator,48,0.067,0.859,0.074,0.0971,positive,0.0,0.3,0.04855
f541cf0b-90b0-4934-8c89-e67fd4f4ec80,A Google user,"To our experimented with this app for a few seconds, and without an add blocker, I counted 85 ads. I got, throughout the day, And they get mad when you want to use an Ad Blocker. Meanwhile, you get three unskippable ads and an ad every time year.Close a video, an ad every time you pause a video and add every time you want to look at a video and an add every time you leave a video",1,2026-01-11 02:18:23,2,youtube,google_play,np,2026-01-16T19:25:40.229987,False,False,False,False,True,True,to our experimented with this app for a few seconds and without an add blocker i counted 85 ads i got throughout the day and they get mad when you want to use an ad blocker meanwhile you get three unskippable ads and an ad every time year close a video an ad every time you pause a video and add every time you want to look at a video and an add every time you leave a video,en,unknown,,no_indicator,79,0.054,0.915,0.032,-0.4215,negative,-0.4125,0.55,-0.417
